{
  "$schema":"https://json-schema.org/draft/2020-12/schema",
  "$id":"https://docs.helianthus.local/schemas/leaf-promotion-captured-multi-leaf-v1.schema.json",
  "type":"object","additionalProperties":false,
  "required":["contract","schema_version","profile","evidence_mode","export_tier","provenance","source_bindings","windows","candidates","campaign_hash"],
  "properties":{
    "contract":{"const":"helianthus.platform.leaf-promotion-captured-multi-leaf.v1"},
    "schema_version":{"const":1},
    "profile":{"const":"CAPTURED_RUNTIME_MULTI_LEAF_V1"},
    "evidence_mode":{"enum":["SANITIZED_CONFORMANCE","LIVE_CAPTURE"]},
    "export_tier":{"const":"PRIVATE_OPERATOR"},
    "provenance":{"$ref":"#/$defs/Provenance"},
    "source_bindings":{"$ref":"#/$defs/SourceBindings"},
    "windows":{"type":"array","minItems":2,"maxItems":2,"items":{"$ref":"#/$defs/Window"}},
    "candidates":{"type":"array","minItems":18,"maxItems":18,"items":{"$ref":"#/$defs/Candidate"}},
    "campaign_hash":{"$ref":"#/$defs/Digest"}
  },
  "$defs":{
    "Digest":{"type":"string","pattern":"^sha256:[0-9a-f]{64}$"},
    "Commit":{"type":"string","pattern":"^[0-9a-f]{40}$"},
    "Token":{"type":"string","minLength":1,"maxLength":256},
    "Timestamp":{"type":"string","pattern":"^[0-9]{4}-[0-9]{2}-[0-9]{2}T[0-9]{2}:[0-9]{2}:[0-9]{2}(?:\\.[0-9]{1,9})?Z$"},
    "NullableToken":{"oneOf":[{"$ref":"#/$defs/Token"},{"type":"null"}]},
    "NullableDigest":{"oneOf":[{"$ref":"#/$defs/Digest"},{"type":"null"}]},
    "NullableCommit":{"oneOf":[{"$ref":"#/$defs/Commit"},{"type":"null"}]},
    "Decimal":{"type":"object","additionalProperties":false,"required":["number","scale"],"properties":{"number":{"type":"integer","minimum":-9007199254740991,"maximum":9007199254740991},"scale":{"type":"integer","minimum":-12,"maximum":12}}},
    "NullableDecimal":{"oneOf":[{"$ref":"#/$defs/Decimal"},{"type":"null"}]},
    "TypedValue":{"oneOf":[
      {"type":"object","additionalProperties":false,"required":["kind","decimal","enum","boolean"],"properties":{"kind":{"const":"NUMERIC"},"decimal":{"$ref":"#/$defs/Decimal"},"enum":{"type":"null"},"boolean":{"type":"null"}}},
      {"type":"object","additionalProperties":false,"required":["kind","decimal","enum","boolean"],"properties":{"kind":{"const":"ENUM"},"decimal":{"type":"null"},"enum":{"$ref":"#/$defs/Token"},"boolean":{"type":"null"}}},
      {"type":"object","additionalProperties":false,"required":["kind","decimal","enum","boolean"],"properties":{"kind":{"const":"BOOLEAN"},"decimal":{"type":"null"},"enum":{"type":"null"},"boolean":{"type":"boolean"}}}
    ]},
    "Provenance":{"type":"object","additionalProperties":false,"required":["class","fixture_id","generator","capture_receipts","deployment_source_commit","deployment_binary_hash"],"properties":{"class":{"enum":["SANITIZED_CONFORMANCE","LIVE_CAPTURE"]},"fixture_id":{"$ref":"#/$defs/NullableToken"},"generator":{"$ref":"#/$defs/NullableToken"},"capture_receipts":{"type":"array","minItems":0,"maxItems":2,"uniqueItems":true,"items":{"$ref":"#/$defs/Digest"}},"deployment_source_commit":{"$ref":"#/$defs/NullableCommit"},"deployment_binary_hash":{"$ref":"#/$defs/NullableDigest"}}},
    "EBusIdentity":{"type":"object","additionalProperties":false,"required":["family","target_address","source_address","opcode","group","instance","register","register_id","selector_hash"],"properties":{"family":{"enum":["B509","B524","B555"]},"target_address":{"type":["integer","null"],"minimum":0,"maximum":255},"source_address":{"type":["integer","null"],"minimum":0,"maximum":255},"opcode":{"type":["integer","null"],"minimum":0,"maximum":255},"group":{"type":["integer","null"],"minimum":0,"maximum":255},"instance":{"type":["integer","null"],"minimum":0,"maximum":255},"register":{"type":["integer","null"],"minimum":0,"maximum":65535},"register_id":{"type":["integer","null"],"minimum":0,"maximum":65535},"selector_hash":{"$ref":"#/$defs/Digest"}}},
    "EEBusIdentity":{"type":"object","additionalProperties":false,"required":["service_id","device_address","entity_address","entity_type","feature_address","feature_type","feature_role","function","field_path","descriptor","unit","source_profile_hash","identity_hash"],"properties":{"service_id":{"$ref":"#/$defs/Token"},"device_address":{"$ref":"#/$defs/Token"},"entity_address":{"type":"array","minItems":1,"maxItems":16,"items":{"type":"integer","minimum":0,"maximum":9007199254740991}},"entity_type":{"$ref":"#/$defs/Token"},"feature_address":{"type":"integer","minimum":0,"maximum":9007199254740991},"feature_type":{"$ref":"#/$defs/Token"},"feature_role":{"const":"server"},"function":{"$ref":"#/$defs/Token"},"field_path":{"type":"array","minItems":1,"maxItems":16,"items":{"$ref":"#/$defs/Token"}},"descriptor":{"$ref":"#/$defs/Token"},"unit":{"anyOf":[{"$ref":"#/$defs/Token"},{"type":"null"}]},"source_profile_hash":{"$ref":"#/$defs/Digest"},"identity_hash":{"$ref":"#/$defs/Digest"}}},
    "NullableEBusIdentity":{"oneOf":[{"$ref":"#/$defs/EBusIdentity"},{"type":"null"}]},
    "NullableEEBusIdentity":{"oneOf":[{"$ref":"#/$defs/EEBusIdentity"},{"type":"null"}]},
    "Sample":{"type":"object","additionalProperties":false,"required":["source","observed_at","valid","capture_generation","poll_id","poll_generation","runtime_epoch","connection_generation","raw_hash","raw_value","value","unit"],"properties":{"source":{"enum":["EBUS","EEBUS"]},"observed_at":{"$ref":"#/$defs/Timestamp"},"valid":{"type":"boolean"},"capture_generation":{"$ref":"#/$defs/Token"},"poll_id":{"$ref":"#/$defs/NullableToken"},"poll_generation":{"$ref":"#/$defs/NullableToken"},"runtime_epoch":{"type":["integer","null"],"minimum":0,"maximum":9007199254740991},"connection_generation":{"type":["integer","null"],"minimum":0,"maximum":9007199254740991},"raw_hash":{"$ref":"#/$defs/Digest"},"raw_value":{"$ref":"#/$defs/TypedValue"},"value":{"$ref":"#/$defs/TypedValue"},"unit":{"anyOf":[{"$ref":"#/$defs/Token"},{"type":"null"}]}}},
    "NullableSample":{"oneOf":[{"$ref":"#/$defs/Sample"},{"type":"null"}]},
    "Conversion":{"type":"object","additionalProperties":false,"required":["mode","source_unit","target_unit","scale","offset"],"properties":{"mode":{"enum":["IDENTITY","AFFINE"]},"source_unit":{"$ref":"#/$defs/Token"},"target_unit":{"$ref":"#/$defs/Token"},"scale":{"$ref":"#/$defs/Decimal"},"offset":{"$ref":"#/$defs/Decimal"}}},
    "NumericComparator":{"type":"object","additionalProperties":false,"required":["class","declared_spine_step","delta","conversion","mapping_hash","outcome"],"properties":{"class":{"const":"NUMERIC_DECLARED_GRANULARITY"},"declared_spine_step":{"$ref":"#/$defs/Decimal"},"delta":{"$ref":"#/$defs/Decimal"},"conversion":{"$ref":"#/$defs/Conversion"},"mapping_hash":{"type":"null"},"outcome":{"enum":["MATCH","MISMATCH","MISSING","IDENTITY_MISMATCH","GENERATION_CHANGED","INVALID","STALE","CONFLICT","NOT_EVALUATED"]}}},
    "MappedComparator":{"type":"object","additionalProperties":false,"required":["class","declared_spine_step","delta","conversion","mapping_hash","outcome"],"properties":{"class":{"enum":["ENUM_EXACT_MAPPING","BOOLEAN_EXACT_MAPPING"]},"declared_spine_step":{"type":"null"},"delta":{"type":"null"},"conversion":{"type":"null"},"mapping_hash":{"$ref":"#/$defs/Digest"},"outcome":{"enum":["MATCH","MISMATCH","MISSING","NOT_COMPARABLE","IDENTITY_MISMATCH","GENERATION_CHANGED","INVALID","STALE","CONFLICT","NOT_EVALUATED"]}}},
    "NoneComparator":{"type":"object","additionalProperties":false,"required":["class","declared_spine_step","delta","conversion","mapping_hash","outcome"],"properties":{"class":{"const":"NONE"},"declared_spine_step":{"type":"null"},"delta":{"type":"null"},"conversion":{"type":"null"},"mapping_hash":{"type":"null"},"outcome":{"const":"NOT_EVALUATED"}}},
    "Comparator":{"oneOf":[{"$ref":"#/$defs/NumericComparator"},{"$ref":"#/$defs/MappedComparator"},{"$ref":"#/$defs/NoneComparator"}]},
    "Assessment":{"type":"object","additionalProperties":false,"required":["window_id","ebus_sample","eebus_sample","skew_ns","max_skew_ns","age_ns","max_age_ns","comparator"],"properties":{"window_id":{"$ref":"#/$defs/Token"},"ebus_sample":{"$ref":"#/$defs/NullableSample"},"eebus_sample":{"$ref":"#/$defs/NullableSample"},"skew_ns":{"type":["integer","null"],"minimum":0,"maximum":9007199254740991},"max_skew_ns":{"type":"integer","minimum":1,"maximum":9007199254740991},"age_ns":{"type":["integer","null"],"minimum":0,"maximum":9007199254740991},"max_age_ns":{"type":"integer","minimum":1,"maximum":9007199254740991},"comparator":{"$ref":"#/$defs/Comparator"}}},
    "Candidate":{"type":"object","additionalProperties":false,"required":["candidate_id","fact_hash","source_status","semantic_path","comparator_class","ebus_identity","eebus_identity","assessments","decision","terminal_state","visibility","dossier_hash"],"properties":{"candidate_id":{"type":"string","pattern":"^m7-candidate-[0-9]{4}$"},"fact_hash":{"$ref":"#/$defs/Digest"},"source_status":{"enum":["RAW_ONLY","WITHHELD"]},"semantic_path":{"oneOf":[{"type":"string","pattern":"^/[a-z0-9_]+(?:/[a-z0-9_]+)*$","maxLength":512},{"type":"null"}]},"comparator_class":{"enum":["NONE","NUMERIC_DECLARED_GRANULARITY","ENUM_EXACT_MAPPING","BOOLEAN_EXACT_MAPPING"]},"ebus_identity":{"$ref":"#/$defs/NullableEBusIdentity"},"eebus_identity":{"$ref":"#/$defs/NullableEEBusIdentity"},"assessments":{"type":"array","minItems":0,"maxItems":2,"items":{"$ref":"#/$defs/Assessment"}},"decision":{"enum":["PROMOTED","WITHHELD"]},"terminal_state":{"oneOf":[{"enum":["CLOUD_ONLY","NOT_TESTED","MISSING","NOT_COMPARABLE","IDENTITY_MISMATCH","GENERATION_CHANGED","INVALID","STALE","CONFLICT","MISMATCH"]},{"type":"null"}]},"visibility":{"enum":["LOCKED_NOT_EXPOSED","RAW_DEBUG_ONLY"]},"dossier_hash":{"$ref":"#/$defs/NullableDigest"}}},
    "Window":{"type":"object","additionalProperties":false,"required":["window_id","phase","started_at","ended_at","capture_generation","process_instance_hash","local_identity_hash","trust_state_hash","admitted_source","eebus_runtime_epoch","connection_generation","ebus_poll_generation","m8_no_drift","rollback_exact"],"properties":{"window_id":{"$ref":"#/$defs/Token"},"phase":{"enum":["PRE_RESTART","POST_RESTART"]},"started_at":{"$ref":"#/$defs/Timestamp"},"ended_at":{"$ref":"#/$defs/Timestamp"},"capture_generation":{"$ref":"#/$defs/Token"},"process_instance_hash":{"$ref":"#/$defs/Digest"},"local_identity_hash":{"$ref":"#/$defs/Digest"},"trust_state_hash":{"$ref":"#/$defs/Digest"},"admitted_source":{"type":"integer","minimum":1,"maximum":255},"eebus_runtime_epoch":{"type":"integer","minimum":0,"maximum":9007199254740991},"connection_generation":{"type":"integer","minimum":0,"maximum":9007199254740991},"ebus_poll_generation":{"$ref":"#/$defs/Token"},"m8_no_drift":{"const":true},"rollback_exact":{"const":true}}},
    "SourceBindings":{"type":"object","additionalProperties":false,"required":["docs_eebus_commit","m7_graph_id","m7_graph_hash","m7_status_id","m7_status_hash","m8_evidence_id","m8_evidence_hash","m8_report_id","m8_report_hash","replay_hash"],"properties":{"docs_eebus_commit":{"const":"657a36d07e52570326384b757a5382a6789f641b"},"m7_graph_id":{"$ref":"#/$defs/Token"},"m7_graph_hash":{"$ref":"#/$defs/Digest"},"m7_status_id":{"$ref":"#/$defs/Token"},"m7_status_hash":{"$ref":"#/$defs/Digest"},"m8_evidence_id":{"$ref":"#/$defs/Token"},"m8_evidence_hash":{"$ref":"#/$defs/Digest"},"m8_report_id":{"$ref":"#/$defs/Token"},"m8_report_hash":{"$ref":"#/$defs/Digest"},"replay_hash":{"$ref":"#/$defs/Digest"}}}
  }
}
