{"campaign_hash":"sha256:1d53a809875178e902791b4fa64d1a51eec28329168a0dd39a54c95c2f73af53","candidates":[{"assessments":[],"candidate_id":"m7-candidate-0001","comparator_class":"NONE","decision":"WITHHELD","dossier_hash":null,"ebus_identity":null,"eebus_identity":null,"fact_hash":"sha256:867157d98ac046e6bc09ae60b4a963e5f7c6d174f12d293b09cc339c7f9dd9a2","semantic_path":null,"source_status":"WITHHELD","terminal_state":"CLOUD_ONLY","visibility":"RAW_DEBUG_ONLY"},{"assessments":[],"candidate_id":"m7-candidate-0002","comparator_class":"NONE","decision":"WITHHELD","dossier_hash":null,"ebus_identity":null,"eebus_identity":null,"fact_hash":"sha256:26df8fd76d3d2804c899a063766075a9cad25ad90cccfcde067c10b95cb793be","semantic_path":null,"source_status":"WITHHELD","terminal_state":"NOT_TESTED","visibility":"RAW_DEBUG_ONLY"},{"assessments":[],"candidate_id":"m7-candidate-0003","comparator_class":"NONE","decision":"WITHHELD","dossier_hash":null,"ebus_identity":null,"eebus_identity":null,"fact_hash":"sha256:4f64a3fb317dee55c8838b2f5406976e3ba6e24f1c977cb141a0e1c1ed300911","semantic_path":null,"source_status":"WITHHELD","terminal_state":"NOT_TESTED","visibility":"RAW_DEBUG_ONLY"},{"assessments":[],"candidate_id":"m7-candidate-0004","comparator_class":"NONE","decision":"WITHHELD","dossier_hash":null,"ebus_identity":null,"eebus_identity":null,"fact_hash":"sha256:aae4e6db120c3ac922e9c981fd80041388c2e17cb099eadcddb34e61008e3490","semantic_path":null,"source_status":"WITHHELD","terminal_state":"NOT_TESTED","visibility":"RAW_DEBUG_ONLY"},{"assessments":[],"candidate_id":"m7-candidate-0005","comparator_class":"NUMERIC_DECLARED_GRANULARITY","decision":"WITHHELD","dossier_hash":null,"ebus_identity":null,"eebus_identity":{"descriptor":"dhwTemperature","device_address":"sanitized-device-v1","entity_address":[1005],"entity_type":"DHWCircuit","feature_address":105,"feature_role":"server","feature_type":"Measurement","field_path":["measurementData","measurementId=0","value"],"function":"measurementListData","identity_hash":"sha256:8888888888888888888888888888888888888888888888888888888888888888","service_id":"sanitized-service-v1","source_profile_hash":"sha256:73d6bb31993f02cce36b38b390ae1703b7536b62748bbb8ec98ee05c4c8fd444","unit":"degC"},"fact_hash":"sha256:8977e5c07fd85b6426bb33339f4ea6611d6b30a2fbe8085c86af4af9ee348e68","semantic_path":"/dhw/temperature_c","source_status":"RAW_ONLY","terminal_state":"MISSING","visibility":"RAW_DEBUG_ONLY"},{"assessments":[],"candidate_id":"m7-candidate-0006","comparator_class":"NUMERIC_DECLARED_GRANULARITY","decision":"WITHHELD","dossier_hash":null,"ebus_identity":null,"eebus_identity":{"descriptor":"dhwTemperature","device_address":"sanitized-device-v1","entity_address":[1006],"entity_type":"DHWCircuit","feature_address":106,"feature_role":"server","feature_type":"Setpoint","field_path":["setpointData","setpointId=1","value"],"function":"setpointListData","identity_hash":"sha256:8888888888888888888888888888888888888888888888888888888888888888","service_id":"sanitized-service-v1","source_profile_hash":"sha256:69e180084671673e3a2b0815ba9d20c8fde675b14e31dd62cace730cedb686f5","unit":"degC"},"fact_hash":"sha256:9b41084d9dff93c429868ba10070a25ef13f2bf8e516f3a1041cc93e4208d716","semantic_path":"/dhw/target_temperature_c","source_status":"RAW_ONLY","terminal_state":"MISSING","visibility":"RAW_DEBUG_ONLY"},{"assessments":[],"candidate_id":"m7-candidate-0007","comparator_class":"ENUM_EXACT_MAPPING","decision":"WITHHELD","dossier_hash":null,"ebus_identity":null,"eebus_identity":{"descriptor":"dhw","device_address":"sanitized-device-v1","entity_address":[1007],"entity_type":"DHWCircuit","feature_address":107,"feature_role":"server","feature_type":"HVAC","field_path":["hvacSystemFunctionData","systemFunctionId=0","currentOperationModeId"],"function":"hvacSystemFunctionListData","identity_hash":"sha256:8888888888888888888888888888888888888888888888888888888888888888","service_id":"sanitized-service-v1","source_profile_hash":"sha256:135322d419dc768fc19bd9bd5f5747ee17a99fa3381e06ac18c029f1f056cd48","unit":null},"fact_hash":"sha256:0bbde5749d3898aa8fae6728f57151c760301aad3a81ac0788ab4f4089f80ab1","semantic_path":"/dhw/operating_mode","source_status":"RAW_ONLY","terminal_state":"MISSING","visibility":"RAW_DEBUG_ONLY"},{"assessments":[],"candidate_id":"m7-candidate-0008","comparator_class":"BOOLEAN_EXACT_MAPPING","decision":"WITHHELD","dossier_hash":null,"ebus_identity":null,"eebus_identity":{"descriptor":"dhw","device_address":"sanitized-device-v1","entity_address":[1008],"entity_type":"DHWCircuit","feature_address":108,"feature_role":"server","feature_type":"HVAC","field_path":["hvacSystemFunctionData","systemFunctionId=0","isOperationModeIdChangeable"],"function":"hvacSystemFunctionListData","identity_hash":"sha256:8888888888888888888888888888888888888888888888888888888888888888","service_id":"sanitized-service-v1","source_profile_hash":"sha256:7874ee90e45f1f354ee9fe09ee495a59ae21e0520ca9a7bc09a65267a0ac2f1e","unit":null},"fact_hash":"sha256:9391dfaf024f5d0f4077cde3432f2a49ea369c671ca8ea8488b9a1231481e5b9","semantic_path":"/dhw/operation_mode_changeable","source_status":"RAW_ONLY","terminal_state":"NOT_COMPARABLE","visibility":"RAW_DEBUG_ONLY"},{"assessments":[],"candidate_id":"m7-candidate-0009","comparator_class":"BOOLEAN_EXACT_MAPPING","decision":"WITHHELD","dossier_hash":null,"ebus_identity":null,"eebus_identity":{"descriptor":"oneTimeDhw","device_address":"sanitized-device-v1","entity_address":[1009],"entity_type":"DHWCircuit","feature_address":109,"feature_role":"server","feature_type":"HVAC","field_path":["hvacSystemFunctionData","systemFunctionId=0","isOverrunActive"],"function":"hvacSystemFunctionListData","identity_hash":"sha256:8888888888888888888888888888888888888888888888888888888888888888","service_id":"sanitized-service-v1","source_profile_hash":"sha256:ba4d1fe0ad86d79bf936e831e23c29929c96e7af67077f70f34e63c01fc29350","unit":null},"fact_hash":"sha256:b877ec270984317b55bff9a6b26af05e9e5eabf4fd51884e9d19f64828b3f2a1","semantic_path":"/dhw/overrun_active","source_status":"RAW_ONLY","terminal_state":"MISSING","visibility":"RAW_DEBUG_ONLY"},{"assessments":[],"candidate_id":"m7-candidate-0010","comparator_class":"NUMERIC_DECLARED_GRANULARITY","decision":"WITHHELD","dossier_hash":null,"ebus_identity":null,"eebus_identity":{"descriptor":"roomAirTemperature","device_address":"sanitized-device-v1","entity_address":[1010],"entity_type":"HVACRoom","feature_address":110,"feature_role":"server","feature_type":"Measurement","field_path":["measurementData","measurementId=0","value"],"function":"measurementListData","identity_hash":"sha256:8888888888888888888888888888888888888888888888888888888888888888","service_id":"sanitized-service-v1","source_profile_hash":"sha256:066e35abe9cb23f1a72d46fbe92b54653e6b5be06f52b789c25ac340aa64dad1","unit":"degC"},"fact_hash":"sha256:acdcb9c06d0568e0f6c5878821400a18d5210782652e0d005a5f696687911ad7","semantic_path":"/zones/zone_1/room_temperature_c","source_status":"RAW_ONLY","terminal_state":"MISSING","visibility":"RAW_DEBUG_ONLY"},{"assessments":[],"candidate_id":"m7-candidate-0011","comparator_class":"NUMERIC_DECLARED_GRANULARITY","decision":"WITHHELD","dossier_hash":null,"ebus_identity":null,"eebus_identity":{"descriptor":"roomAirTemperature","device_address":"sanitized-device-v1","entity_address":[1011],"entity_type":"HVACRoom","feature_address":111,"feature_role":"server","feature_type":"Setpoint","field_path":["setpointData","setpointId=1","value"],"function":"setpointListData","identity_hash":"sha256:8888888888888888888888888888888888888888888888888888888888888888","service_id":"sanitized-service-v1","source_profile_hash":"sha256:9549dbceaf2cd0d0b94929f4bfa2ee5904f606d14744fb1af2809cc2888c32e0","unit":"degC"},"fact_hash":"sha256:07ea12e4df387e2c4eb00e310538753a52767a47527d1c8ad2294447f7c945ce","semantic_path":"/zones/zone_1/target_temperature_c","source_status":"RAW_ONLY","terminal_state":"MISSING","visibility":"RAW_DEBUG_ONLY"},{"assessments":[],"candidate_id":"m7-candidate-0012","comparator_class":"ENUM_EXACT_MAPPING","decision":"WITHHELD","dossier_hash":null,"ebus_identity":null,"eebus_identity":{"descriptor":"heating","device_address":"sanitized-device-v1","entity_address":[1012],"entity_type":"HVACRoom","feature_address":112,"feature_role":"server","feature_type":"HVAC","field_path":["hvacSystemFunctionData","systemFunctionId=0","currentOperationModeId"],"function":"hvacSystemFunctionListData","identity_hash":"sha256:8888888888888888888888888888888888888888888888888888888888888888","service_id":"sanitized-service-v1","source_profile_hash":"sha256:4810adcd511113ecc77283384065950fc6e66ac3644dd7f168db2b14778633c0","unit":null},"fact_hash":"sha256:b4358e7b5151be311c7b72e118d742dbb1357d87f217edc515428a3c096c6cf9","semantic_path":"/zones/zone_1/operating_mode","source_status":"RAW_ONLY","terminal_state":"MISSING","visibility":"RAW_DEBUG_ONLY"},{"assessments":[],"candidate_id":"m7-candidate-0013","comparator_class":"BOOLEAN_EXACT_MAPPING","decision":"WITHHELD","dossier_hash":null,"ebus_identity":null,"eebus_identity":{"descriptor":"heating","device_address":"sanitized-device-v1","entity_address":[1013],"entity_type":"HVACRoom","feature_address":113,"feature_role":"server","feature_type":"HVAC","field_path":["hvacSystemFunctionData","systemFunctionId=0","isOperationModeIdChangeable"],"function":"hvacSystemFunctionListData","identity_hash":"sha256:8888888888888888888888888888888888888888888888888888888888888888","service_id":"sanitized-service-v1","source_profile_hash":"sha256:43ecb9b13d8091c7b63f109ed997d1a6b7802309f5e9bac27002065c74863f09","unit":null},"fact_hash":"sha256:e095c1ad351cd414073c64f3dcdc26dce9f00996f3b8e3d99edca222a501e4a8","semantic_path":"/zones/zone_1/operation_mode_changeable","source_status":"RAW_ONLY","terminal_state":"NOT_COMPARABLE","visibility":"RAW_DEBUG_ONLY"},{"assessments":[],"candidate_id":"m7-candidate-0014","comparator_class":"NUMERIC_DECLARED_GRANUL